{
  "id": "cats-vs-dogs-v2-100-128-unquantized-task",
  "name": "Cats vs dogs example training test",
  "details": "",
  "task": "train",
  "model": {
    "id": "cats-vs-dogs-v2-100-128-unquantized"
  },
  "taskParameters": {
    "numEpochs": 10,
    "batchSize": 2,
    "shuffle": false,
    "placeholders": [
      {
        "name": "placeholder_adam_learning_rate",
        "type": "array",
        "dtype": "float32",
        "shape": [1],
        "value": [0.001]
      }
    ]
  }
}
